Doc_Id,Review,Cleaned Data,Sentimental Analysis
Review 1,"Every once in a while a movie comes, that truly makes an impact. Joaquin's performance and scenography in all it's brilliance. Grotesque, haunting and cringy. Hard to watch at times,... but so mesmerizing, you won't blink an eye watching it. Tragic, but with seriously funny moments. Emotional rollercoaster - sometimes, with multiple emotions popping-up at the same time.

this is far from a typical action-riddled predictable super-hero movie - it's a proper psychological thriller/drama, with the single best character development I have ever seen.",everi movi come truli make impact joaquin perform scenographi brillianc grotesqu hunt cring hard watch time mesmer wont blink eye watch tragic serious funni moment emot rollercoast sometim multipl emot pop time far typic actionriddl predict superhero movi proper psycholog thrillerdrama singl best charact develop ever seen,Positive
Review 2,"This is a movie that only those who have felt alone and isolated can truly relate to it. You understand the motive and you feel sorry for the character. A lot of people will see this movie and think that it encourages violence. But truly, this movie should encourage each and every one of us to become a better person, treat everyone with respect and make each other feel like they belong in this world, instead of making them feel isolated.",movi felt alon isol truli relat understand motiv feel sorri charact lot peopl see movi think encourag violenc truli movi encourag everi one u becom better person treat everyon respect make feel like belong world instead make feel isol,Positive
Review 3,"Truly a masterpiece, The Best Hollywood film of 2019, one of the Best films of the decade... And truly the Best film to bring a comic book so chillingly and realistically to real ife. Remarkable Direction, Cinematography, Music and the Acting. Some people are surprised to find it DISTURBING and VIOLENT, but it's a necessity and message. It's about society and reflects those underappreciated/unrecognized/bullied people, proving they can do something too. The way it shows class difference, corruption and how rich and talented rule others around them is not exaggerated and that's what makes it different. It's BELIEVABLE. There could be multiple JOKERs living in our society that could shake those around them in much bitter way than the film shows making people uncomforting people. Consider this a wake up call, a message, but first a film. A PERFECT film.",truli masterpiec best hollywood film 2019 one best film decad truli best film bring comic book willingli realist real if remark direct cinematographi music act peopl surpris find disturb violent necess messag societi reflect underappreciatedunrecognizedbulli peopl prove someth way show class differ corrupt rich talent rule other around exagger that make differ believ could multipl joke live societi could shake around much bitter way film show make peopl comfort peopl consid wake call messag first film perfect film,Positive
Review 4,"Joaquin Phoenix gives a tour de force performance, fearless and stunning in its emotional depth and physicality. It's impossible to talk about this without referencing Heath Ledger's Oscar-winning performance from The Dark Knight, widely considered the definitive live-action portrayal of the Joker, so let's talk about it. The fact is, everyone is going to be stunned by what Phoenix accomplishes, because it's what many thought impossible - a portrayal that matches and potentially exceeds that of The Dark Knight's Clown Prince of Crime",joaquin phoenix give tour de forc perform fearless stun emot depth physic imposs talk without referenc heath ledger oscarwin perform dark knight wide consid definit liveact portray joke let talk fact everyon go stun phoenix accomplish mani thought imposs portray match potenti exce dark knight clown princ crime,Neutral
Review 5,"Most of the time movies are anticipated like this they end up falling short, way short. Joker is the first time I was more than happy with the hype. Please ignore the complaints of ""pernicious violence"" as they are embarrassing to say the least. We haven't seen a comic movie this real before. If we ever ""deserved"" a better class of criminal - Phillips and Phoenix have delivered. This is dark, Joker IS dark and you will fall in love with the villain as you should. The bad guys are always more romantic anyway.",time move anticip like end fall short way short joke first time happi hope plea ignor complaint pernici violenc embarrass say least haven seen comic movi real ever deserv better class crimin phillip phoenix deliv dark joke dark fall love villain bad gun alway romant anyway,Negative
Review 6,"Let me start off by saying if Joaquin Phoneix doesn't get his Oscar for this movie. Then the Oscars should be cancelled. Phoneix is amazing as you might've heard from every review ever! But Todd Phillips. Is at his best here. The story lines he takes and visuals are just breathtaking. The score!! Omg the Score! Every time that score came on, I felt very uncomfortable, like something horrible was about to happen. It was GREAT. The Inspirations from Taxi Driver and King of Comedy are there, and add so much for the movie. And I got to be honest. There are scenes that are very violent. And its disturbing. But I honestly expected it to be WAYYYY more violent from all the controversy going on. Overall this movie was GREAT. Come Oscar season, it needs to be nominated for Best Picture, ScreenPlay, Cinematography, Actor, Score and Director",let start say joaquin phoenix doesn get oscar movi scar cancel phoenix amaz might heard everi review ever told phillip best stori line take visual breathtak score org score everi time score came felt uncomfort like someth horribl happen great inspir taxi driver king comedi add much movi got honest scene violent disturb honestli expect wayyyi violent controversi go overal movi great come oscar season need nomin best pictur screenplay cinematographi actor score director,Positive
Review 7,"I get why some people hate this . It's because of the political message and how some people think that you need get empathy for Arthur's madness. But come on that is not the point and it will never be. Enjoy this masterpiece because Joaquin Phoenix and Todd Phillips overdid themselves with this movie . The acting,music and cinematography are just amazing ! Please enjoy the movie without overthinking it.",get peopl hate polit messag peopl think need get empti arthur mad come point never enjoy masterpiec joaquin phoenix told phillip overdid movi actingmus cinematographi amaz plea enjoy movi without overthink,Positive
Review 8,"I have seen Joker yesterday at Venice an early ill-fated screening. We had some trouble with audio that lead to a near-hour delay, but it definitely was worth it.

Joker deserved to be presented at Venice Film Festival, an event that regards cinema as a form of art, because this film is far from a blockbuster or a mere entertainer movie, as most films in the genre are.

It focuses on the psyche of the main character, as it slowly crumbles under the pressure of society. And thus, Joaquin Phoenix does a wonderful performance, earning almost surely a nomination at the oscars at least. It's a take on the Joker that differs from Ledger's, but I'd say that both are equally as good. The main difference might be that Ledger's joker is a rational that acts insane, while Phoenix's is insane to the root.

Despite being a movie about a superhero villain, Joker is much superior to most of the movies of the genre (I'd exclude the Dark Knight Trilogy only, but Joker is easily as good as Nolan's movies, or at least very close). It is a small-scaled film, with a distinct style and cinematography (that cannot but be appreciated) and a set of very cinephile references that however do not feel too forced or overly opressive. (most notable are the similarities to Scorsese's 'Taxi Driver' and his 'The King of Comedy', but also Chaplin's 'Modern Times' is somewhat referenced).

I am eager to see more non-comedic efforts by Todd Phillips. This movie was so far probably the best of 2019 (at worst contested so far only by Dolor Y Gloria or Once Upon a Time in Hollywood), and that should be very convincing.",seen joke yesterday venic earli inflat screen troubl audit lead nearhour delay definit worth joke deserv present venic film festiv event regard cinema form art film far blockbust mere entertain movi film gene focus psychic main charact slowli crumbl pressur societi thu joaquin phoenix wonder perform earn almost sure nomin scar least take joke differ ledger id say equal good main differ might ledger joke ration act insan phoenix insan root despit movi superhero villain joke much superior move gene id exclud dark knight trilog joke easili good plan move least close smallscal film distinct style cinematographi can not appreci set cinephil refer howev feel forc overlay oppress notabl similar scorses taxi driver king comedi also chain modern time somewhat refer eager see noncomed effort told phillip movi far probabl best 2019 worst contest far door gloria upon time hollywood convinc,Positive
Review 9,"It's sad that Joaquin missed Oscar for 'The gladiator' as he was very compelling Villain. But I am quite confident he will win it for the 'Joker'. Damn what a movie !!! Keeps u on the toes all the time. Unpredictable storyline and really a deep interesting plot. Did I forget to mention acting ? Damn Do niro and Joaquin teach u what really is 5 star acting. To enjoy this movie, get a wine in your hand, close the curtains, turn of ur cellphones and put do not disturb sign on ur door. Best Dark thriller suspense movie you will get to experience.",sad joaquin miss oscar gladiat compel villain quit confid win joke damn movi keep u toe time predict storylin realli deep interest plot forget mention act damn no joaquin teach u realli 5 star act enjoy movi get wine hand close curtain turn or cellphon put disturb sign or door best dark thrill suspens movi get experi,Positive
Review 10,"This movie causes the audience to consider many topics on morality, particularly the poor choices made by the Joker. The Joker is more relatable in this movie than antagonists usually are. I think this gives a more realistic view of ""bad"" people, who are not usually 100% bad in all ways as society often judges. It is important to know when to sympathize with the Joker (towards the beginning of the movie), and when he needs to be identified as a threat (when he begins making certain bad choices). This movie is only suitable for adults who are willing to pick it apart and think critically about it. It isn't for light amusement. That substance is what makes it so good.

If you aren't able to ponder underlying themes on your own, and you have to be handed all your thoughts to you, then this isn't the best movie for you.",movi caus audienc consid mani topic moral particularli poor choic made joke joke reliabl movi antagonist usual think give realist view bad peopl usual 100 bad way societi often judg import know sympath joke toward begin movi need identifi threat begin make certain bad choic movi suitabl adult will pick apart think clinic isn light amus substanc make good agent abl ponder underli theme hand thought isn best movi,Positive
Review 11,"The movie affects you in a way that makes it physically painful to experience, but in a good way.",movi affect way make physic pain experi good way,Positive
Review 12,"The acting, cinematography, sound design, and the script itself is phenomenal. This movie is a triumph. Joaquin Pheonix deserves an Oscar win for this tbh.",act cinematographi sound design script phenomenon movi triumph joaquin phoenix deserv oscar win th,Positive
Review 13,"Need I say more? Everything about this Movie is Masterful in every single way! Joker isn't just an awesome comic book movie, it's an awesome movie, period. It offers no easy answers to the unsettling questions it raises about a cruel society in decline. Joaquin Phoenix's fully committed performance and Todd Phillips' masterful albeit loose reinvention of the DC source material make Joker a film that should leave comic book fans and non-fans alike disturbed and moved in all the right ways.",need say everyth movi wast everi singl way joke isn awesom comic book movi awesom movi period offer easi answer settl question rais cruel societi declin joaquin phoenix fulli commit perform told phillip wast albeit loo invent do sourc materi make joke film leav comic book fan nonfan alik disturb move right way,Positive
Review 14,I will stop watching movies if Joaquin Phoenix is not awarded Oscar for his tremendous acting.,stop watch move joaquin phoenix award oscar tremend act,Positive
Review 15,"I quit relying on critic reviews years ago... I noticed for this movie that the critics ratings were low but viewer ratings were high. That being said, what is the point of a critic when for this movie, they are oh so wrong. I went and saw this tonite with my mom. I went in skeptical and w some what low expectations. I knew not to expect your typical super hero movie. What we got was a masterpiece. I went in expecting sheer boredom and I was instead on the edge of my seat the whole time. Not action edge of your seat, it was a fear of what he may do or say next edge of your seat. To see this character evolve into what we all know as the #1 villain of Batman was beyond genius and Joaquin Phoenix is a true master at perfecting the art of consuming himself into this character. I may be all over the place with this but I don't care. This movie, the story, the acting, directing, effects, everyone brought their A game and JP definitely deserves a nod and win for this role. And no, there is no comparison here to Jack Nicholson or Heath Ledger. Each actor took on this character and different levels, different story points and different points in time, so any comparison would just not be feasible or fair to any of the actors as they embraced him and made him come to life in their own genius way!",quit reli critic review year ago notic movi critic rate low viewer rate high said point critic movi oh wrong went saw tone mon went skeptic w low expect knew expect typic super hero movi got masterpiec went expect sheer boredom instead edg seat whole time action edg seat fear may say next edg seat see charact evolv know 1 villain batman beyond geniu joaquin phoenix true master perfect art consum charact may place dont care movi stori act direct effect everyon brought game up definit deserv nod win role comparison jack nicholson heath ledger actor took charact differ level differ stori point differ point time comparison would feasibl fair actor embrac made come life geniu way,Neutral
Review 16,"I thought this film was good but I just don't get the hype personally. The acting was amazing and the film was good overall but I think 'masterpiece' and 'film of the year' are a bit overused throughout the reviews. In no way did I dislike this film, I thought it was really good, just overhyped. I feel as though a lot of the 10/10 reviews are purely based on the fact that it already has amazing reviews and so people want to carry the praise further and that it is about the joker. If this film was released and was about some random guy in the same situation, I don't think the reviews would be as high but maybe that's the point.",thought film good dont get hope person act amaz film good overal think masterpiec film year bit vers throughout review way dislik film thought realli good overhyp feel though lot 1010 review pure base fact alreadi amaz review peopl want carri prais joke film releas random guy situat dont think review would high mayb that point,Positive
Review 17,"I went into this film expecting an all-time classic based on the reviews I had read & what I ended up watching was just a decent film overall. Phoenix is outstanding...so he definitely did his part. But I feel like if you've seen the trailers you've seen the movie because the best way I can describe this film is it feels like a 2 hour version of the trailer. At 2 hours it's a relatively common runtime, but it felt a lot longer...which isn't good. I'd say this is much more of a rental than a theater movie. Kinda just....eh.",went film expect allie classic base review read end watch decent film overal phoenix outstand definit part feel like you seen trailer you seen movi best way describ film feel like 2 hour version trailer 2 hour rel common aunti felt lot longerwhich isn good id say much rental theater movi kind just,Negative
Review 18,"Do not really understand all the tens here. Sure, a good movie, good acting, nice shooting. But the plot is not so intriguing. At times it is really long and somewhat boring. I needed to double-check the genre to see if this is a drama or what. Crime, drama, thriller it said. I would put it maybe 90% in the drama and rest in thriller.

I miss more dialogue, more depth, more substance. The plot is really not more then a somewhat crazy person becoming a bit crazier. Sure there is an undertone in that it is society and the system and the mean character of people that is bringing him down and creating the evil beast which later wants to destroy everything. Absolutely, but I think it is not intriguing story and plot and dialogue enough to give this a ten.

Worthy of watching, yes. But not amazing",realli understand ten sure good movi good act nice shoot plot intrigu time realli long somewhat bore need doublecheck gene see drama crime drama thrill said would put mayb 90 drama rest thrill miss dialogu depth substanc plot realli somewhat crazi person becom bit brazier sure underton societi system mean charact peopl bring creat evil beast later want destroy everyth absolut think intrigu stori plot dialogu enough give ten worthi watch ye amaz,Negative
Review 19,"When I heard everyone saying that this is the film of the year and all the reviews flooding in with 10's, I was quite hyped and excited for this movie. When I walked out of the cinema, I felt hollow and empty.

Before I continue writing, let me say this, This is NOT the film of the year nor is it a real masterpiece. The cinematography is excellent and the acting is incredible, that's just it. The side-characters are bland and overly dramatic. The plot heavily relies on plot-twists and the film is so harsh that it actually falls flat on it's face.

Are there no good points though? Phoenix is phenomenal and the score is great. The cinematography is also incredible but the plot is not that great at all. It even has plot holes and scenes that left me empty.

Film of the year? Nope.",heard everyon say film year review flood wa quit hope excit movi walk cinema felt hollow empti continu write let say film year real masterpiec cinematographi excel act incred that sidecharact bland overlay dramat plot heavili relief plottwist film harsh actual fall flat face good point though phoenix phenomenon score great cinematographi also incred plot great even plot hole scene left empti film year hope,Negative
Review 20,"Joaquin Phoenix gives Heath Ledger a run for his money, true story. This is not a popcorn fluff comic book flick. DO NOT TAKE YOUR KIDS TO SEE THIS MOVIE. Shut down all ballots for the Oscar, Joaquin is taking that one home hands down. One of the best origin stories EVER put out. The only downside to this movie, is that it is a stand alone film that will have no sequels or ties to the DC Universe. Todd Philips take on the Joker is one of pure brilliance and Joaquin Phoenix was the Joker we deserved. He didn't steal from Jack or Heath but yet you got a taste of both.",joaquin phoenix give heath ledger run money true stori popcorn fluff comic book flick take kiss see movi shut ballot oscar joaquin take one home hand one best origin stori ever put downsid movi stand alon film sequel tie do univers told philip take joke one pure brillianc joaquin phoenix joke deserv didn steal jack heath yet got tast,Positive
Review 21,"The recurring themes of so many of the 10 star reviews here should tell you a lot about this movie and its audience. If you can't get through a movie review without tossing in one or more claims that ""THIS movie is so much better and smarter than YOUR superhero movie"" (or even basing your entire review around this premise), then I hate to break it to you, but kid, you're nowhere near as intelligent and grown up as you think you are. This ""my comic publisher is better than yours"" BS should have been left behind on your grade school playground, it has absolutely no relevance to the quality of this movie, and your opinion of this movie should be considered highly suspect if you're in this group.

I gotta say, if this movie was also your idea of the most perfect film ever made, you really need to get out more. Look, I get it. If you live in a safe little box where all you watch are superhero movies and mainstream blockbusters then I understand how exposure to themes like this for the first time would seem new and exciting to you, and I think we can all agree that this is probably the best DC Comics related movie in the last decade or so (though that's not a high bar to meet) and of course Joaquin Phoenix is a very talented actor, but stop and take a step back and look at this thing.

Joker does indeed present a theme that is of importance to our society, that of the neglect and demonizing of the mentally ill to a degree that sometimes creates monsters which everyone around them should have seen coming a mile away if they hadn't been too busy looking away to avoid feeling uncomfortable. Unfortunately, reminding us all of the fact that this situation still exists is all this movie really has to say. It dances around important subjects like ""HEY KIDS, CLASS INEQUALITY!"", but then never offers any actual insight into them, usually because it's too busy making forced Batman references or dropping cringey little edgy moments like the ""Don't smile"" sign scene which seem to have been designed solely to have something for Hot Topic to print a new t-shirt of. Between that and every single plot twist being telegraphed so very far in advance because a lot of us have seen all these exact same twists so very many times before, I just wasn't impressed.

Perhaps if this had been an actual stand-alone movie of its own instead of being shackled by its completely unnecessary ties to the Batman universe it could have done something more interesting with its themes. Don't get me wrong, I don't have any problem with superhero movies, but it just feels so gratuitous here, as if someone came up with this idea, pitched it to an executive, and was told ""sounds great, but can you make it a Batman movie somehow?"", and I'm sorry, but I'm just not into a movie trying to tell me a half-hearted, yet dead-serious speech about mental illness in modern society while simultaneously constantly reminding me that it's technically a superhero movie because $$$",recur theme mani 10 star review tell lot movi audienc can get movi review without toss one claim movi much better smarter superhero movi even basin entir review around premis hate break kid your nowher near intellig grown think comic publish better is left behind grade school playground absolut relev qualiti movi opinion movi consid highli suspect your group gutta say movi also idea perfect film ever made realli need get look get live safe littl box watch superhero move mainstream blockbust understand exposur theme like first time would seem new excit think agre probabl best do comic relat movi last decad though that high bar meet cours joaquin phoenix talent actor stop take step back look thing joke inde present theme import societi neglect demon mental ill degre sometim creat monster everyon around seen come mile away hadn busi look away avoid feel uncomfort unfortun remind u fact situat still exist movi realli say danc around import subject like hey kiss class inequ never offer actual insight usual busi make forc batman refer drop cring littl edg moment like dont smile sign scene seem design sole someth hot topic print new shirt everi singl plot twist telegraph far advanc lot u seen exact twist mani time want impress perhap actual standalon movi instead shock complet unnecessari tie batman univers could done someth interest theme dont get wrong dont problem superhero move feel gratuit someon came idea pitch execut told sound great make batman movi somehow in sorri in movi tri tell hardheart yet deadseri speech mental ill modern societi simultan constantli remind technic superhero movi,Neutral
Review 22,If I could write just one word and say no more I'd say perfection!,could write one word say id say perfect,Positive
Review 23,"The music. The intense. The realism. The performance. The story. Such a perfect combination of everything. I never felt that a character like joker could be real until I saw this. Phoenix shows us what a joker is in our society and shows us how power can be obtained. Philips on the other hand had the perfect choice of music, camera angles, lighting and every important factor. Overall, I did not expect the story to be this perfect. Too many shocking turns happened and it really does represent today's society. If I was in the first screening, I would have applauded for 80 min not 8.",music intens realism perform stori perfect combin everyth never felt charact like joke could real saw phoenix show u joke societi show u power obtain philip hand perfect choic music camera angl light everi import factor overal expect stori perfect mani shock turn happen realli repres today societi first screen would applaus 80 min 8,Positive
