Doc_Id,Review,Cleaned Data,Sentimental Analysis
Review 63,"I was not a fan of Joaquin Phoneix, but his performance was a career best and his Oscar win a big shock but well deserved. This is the darkest film since American Psycho with a true to characters story that has ever been told. Rejected by mother rejected by society and yet he still smiles. How this film never won best picture is all that's wrong with Oscars and they went with Green book to be safe. Robert de Niro always surprises me how good his acting is. They nominated The film Favorite instead of this film a film where a fat lady gets basted like a turkey and two women fight over right to do it.",fan joaquin phoenix perform career best oscar win big shock well deserv dark film sinc american psychic true charact stori ever told reject mother reject societi yet still smile film never best pictur that wrong scar went green book safe robert de no alway surpris good act nomin film favorit instead film film fat ladi get base like turkey two woman fight right,Positive
Review 64,"I think it's understandable to see why people wouldn't like this movie, it's not a base villian orgin story that we expect from marvel or DC and I think many people expected that going in. The film is very uncomfortable and that's the point. At no point do you feel like the bad things Author is doing is ok, you know it's wrong but you have understanding on why this broken man is making these choices and the situations he's been forced into by predjudice and violence from an outside society. The praise for this movie is well deserved and the messages and themes are important and should be dissected. Though be really for a very bloody and intense experience.",think understand see peopl wouldn like movi base villain origin stori expect marvel do think mani peopl expect go film uncomfort that point point feel like bad thing author ok know wrong understand broken man make choic situat he forc prejudic violenc outsid societi prais movi well deserv messag theme import dissect though realli bloodi intens experi,Positive
Review 65,"Like the headline says, messed up, interesting. No wonder Phoenix won an academy award.",like headlin say miss interest wonder phoenix academi award,Negative
Review 66,"The real clowns here are the people rating this masterpiece of a movie with less than 8*. There is something really wrong in someone's head when he rates this movie with 1* like it's the worst movie ever made! Ok, we get it snowflakes, you want to feel different. Dissing this great film makes you feel good? Believe me, just stay away from reviews like that, they don't even worth a glance. See this great movie for yourselves. At the least, I guarantee you will not waste your time.",real clown peopl rate masterpiec movi le 8 someth realli wrong someon head rate movi 1 like worst movi ever made ok get snowflak want feel differ kiss great film make feel good believ stay away review like dont even worth glanc see great movi least guarante wast time,Negative
Review 67,"W.O.W!!! What can I say about how brilliant Phoenix act performance is ?? In shortcut,movie of the year 💯/💯👏",now say brilliant phoenix act perform shortcutmovi year,Neutral
Review 68,The ending is what matters in a movie. And this movie has a kind of ending which would leave many speechless. It's indeed a masterpiece:),end matter movi movi kind end would leav mani speechless inde masterpiec,Positive
Review 69,"I don't understand why some people find it boring when this feels like watching someone's documentar.

All you people think is just fight scenes, that's why you'll never find any substance of any other types.

Hollywood's modern superhero genre movies are seriously predictable and cliche, this movie is probably not, maybe. So, go on",dont understand peopl find bore feel like watch someon documentari peopl think fight scene that you never find substanc type hollywood modern superhero gene move serious predict calech movi probabl mayb go,Negative
Review 70,"I do agree that Joaquin's performance was great, very well done and not an easy part to pull off. That however, was the only good part of the film. Movie was dark as I expected, but so much SLOW dialog it was putting me to sleep. Parts of the movie were VERY predictable, though a couple (literally two) of surprises that were good but didn't out weigh a very slow moving poorly laid out story. I say skip this one and wait for it to hit the other subscription services, I'd ask for my money back but I did stay till the end.",agre joaquin perform great well done easi part pull howev good part film movi dark expect much slow diplo put sleep part movi predict though coupl liter two surpris good didn weigh slow move poorli laid stori say skin one wait hit subscript servic id ask money back stay till end,Negative
Review 71,"Joker is a unique experience It is more than a movie. It is very relatable, there are still a lot of jokers out there who are being bullied and mistreated day in and day out this movie speaks for the weak and unheard voices of the society we live in.",joke uniqu experi movi reliabl still lot joke pull mistreat day day movi speak weak unheard voic societi live,Positive
Review 72,"An outstanding performance by Joaquin Phoenix which completely embodies Joker's character. This is a film which people, decades from now, will be watching and inevitably will be rendered speechless by how exceptional it is.",outstand perform joaquin phoenix complet embodi joke charact film peopl decad watch inevit render speechless except,Positive
Review 73,"This movie is so strong and Mr Phoenix so impressive that I can nothing but pray to god and say thank you for the creation of those emotions I got watching this movie.

It is the most brutal story about (lack of) love I have ever seen. Brutally human, political and mind blowing especially in regards to the deep connection you get to a person in our society that is in so deep need of just human warmth.

The movie is a piece of art and I have rarely felt such emotions watching violent scenes.

Must see and ""must discuss""

Peace.",movi strong mr phoenix impress noth pray god say thank creation emot got watch movi brutal stori lack love ever seen brutal human polit mind blow especi regard deep connect get person societi deep need human warmth movi piec art rare felt emot watch violent scene must see must discus peac,Positive
Review 74,"This is a stunning piece of work from JP and director Todd Phillips , totalling exceeded expectations and a truly Oscar worthy performance. A mesmerising tour de force from start to finish...excellent",stun piec work up director told phillip total exceed expect truli oscar worthi perform mesmeris tour de forc start finishexcel,Positive
Review 75,"Joker is basically the lite edition or postmodern version of Fight Club or the Scorsese films it lifts from. It's interesting to see how easily words like masterpiece and groundbreaking are being used for this, and that is the one joke that this movie successfully pulls off. It's just a whole lot of self-seriousness and posturing and is essentially hollow. It pretends to say a lot but ends up saying very little or nothing at all, not about the character nor about the society he's part of.

It is also 'Joker' only in name and has very little to do with the super-villain. I'm all for a different interpretation and even an origin story for the joker but this movie fails to recognise or capture his spirit. Even 'Proto-Joker' doesn't quite do it justice, and I can think of a dozen more suitable titles e.g. Arthur, The Untalented Mr. Fleck, Smoker, Poser etc. Infact he's more akin to a less dangerous but also mentally unstable villain like Ratcatcher or Calendar Man though just with a clown theme, and is not even close to embodying the joker's extreme form of nihilism. It's not that it has to be a comic-book accurate portrayal, that would be irrelevant if it was genuinely a good movie. But far from being a masterpiece , it doesn't quite manage even that. It fails not just as an inaccurate portrayal of the Joker's spirit or essence, but also as a film about a person going over the edge.

The weakest aspect of the movie for me is the poor to average direction. The movie lacks any of the subtlety and nuance that I was hoping for and what unfolds is not as much character development as it is things happening to Arthur. A good example of the poor writing and direction is the very Trump-like and one-dimensional Thomas Wayne character. This first became obvious during a scene in which some people happened to know the entire lyrics to a clown song. In a movie that otherwise tries very hard to be realistic that felt very unnecessary and took me out of the experience and it felt very contrived and predictable after that. It takes too many obvious liberties and plot conveniences to move the story forward in an unnatural and unrefined way, and ultimately felt like they tried to disguise the poor writing and direction with a dark and gritty atmosphere instead of those elements complementing each other.

The only reason to watch this movie is Phoenix's performance, which while not groundbreaking is good enough to earn an awards nomination or two. I wouldn't put it in the same league as Heath Ledger's portrayal but they were two very different roles and characters. Ledger made his joker seem effortless while one can really see the strain and work Phoenix puts in. To put it simply, Ledger made it seem natural and didn't look like he was acting while with Phoenix you really know that he is, even to the extent that it may seem like overacting at times. Perhaps owing to the more physical nature of this version of whoever this character is supposed to be, that's not necessarily a criticism.

Overall an average film at best that pretends to be a lot more. I don't see this one ageing well or being remembered decades later the way Fight Club or the Scorsese movies it's ""inspired"" by, or CBM's like Dark Knight or Logan or even Tim Burton's Batman, are remembered today.",joke basic like edit postmodern version fight club score film lift interest see easili word like masterpiec groundbreak use one joke movi success pull whole lot selfseri pour essenti hollow pretend say lot end say littl noth charact societi he part also joke name littl supervillain in differ interpret even origin stori joke movi fail recognis captur spirit even protojok doesn quit justic think dozen suitabl titl eg arthur talent mr fleck smoker power etc intact he akin le danger also mental unstabl villain like ratcatch calendar man though clown theme even close embodi joke extrem form nihil comicbook accur portray would irrelev genuin good movi far masterpiec doesn quit manag even fail inaccur portray joke spirit essenc also film person go edg nearest aspect movi poor averag direct movi lack subtl franc hope unfold much charact develop thing happen arthur good exampl poor write direct trumplik onedimension thoma wayn charact first becam obviou scene peopl happen know entir lyric clown song movi otherwis tri hard realist felt unnecessari took experi felt contriv predict take mani obviou liberti plot conveni move stori forward unnatur undefin way ultim felt like tri disguis poor write direct dark gritti atmospher instead element complement reason watch movi phoenix perform groundbreak good enough earn award nomin two wouldn put leagu heath ledger portray two differ role charact ledger made joke seem effortless one realli see strain work phoenix put put simpli ledger made seem natur didn look like act phoenix realli know even extent may seem like oper time perhap owe physic natur version whoever charact suppos that necessarili critic overal averag film best pretend lot dont see one be well rememb decad later way fight club score move inspir cm like dark knight loan even tim button batman rememb today,Negative
Review 76,"People are so hyped about it because it's so pretentious, that it makes them feel like ""enlightened"" ones. I haven't heard a good review of this movie from smart or intelligent people. Only those whose main movie list consists of actions and comedies call this a piece of art.

A wife of a friend even called those who hadn't liked the movie ""lemmings"" but she's the one from the countryside who dreams of expensive brands and it actually made me laugh my ass out. Now you have an idea who this movie was made for.

The plot is the main weakness. The Phoenix overplays and it feels uncomfortable to watch. The camera work feels very cheap and the overall boredom of the movie makes you start noticing all the imperfections. I would give it 5-6 out of 10 but there are too many pretentious dummies who gave 10 points so I'll even out the difference.",peopl hope pretens make feel like enlighten one haven heard good review movi smart intellig peopl whose main movi list consist action remedi call piec art wife friend even call hadn like movi leg she one countrysid dream expens band actual made laugh as idea movi made plot main weak phoenix overlay feel uncomfort watch camera work feel cheap overal boredom movi make start notic imperfect would give 56 10 mani pretens duti gave 10 point ill even differ,Negative
Review 77,"The movie was excellent and amazing, from the beginning that Joaquin's personality is seen as he evolves in the Joker until the end, Joker is the most difficult character to do and I think Joaquin did it!!",movi excel amaz begin joaquin person seen evolv joke end joke difficult charact think joaquin,Positive
Review 78,"I was so looking forward to this film given all the hype about brilliant acting etc but yet again what a let down!

The film had no real storyline in the past or the present and although the acting was brilliant I had real trouble understanding the plot, if at all there was one.

ONE STAR IS FOR THE ACTORS",look forward film given hope brilliant act etc yet let film real storylin past present although act brilliant real troubl understand plot one one star actor,Negative
Review 79,"Please go watch this movie! This is the first time I've ever wrote a review on this app and I've been using it to read reviews for years! That's how good this film is. Very dark, grimy and disturbing, exactly how an origin film about the joker should be. I have no doubt it will win multiple oscars. Do yourself a favor and go see it!!!",plea go watch movi first time give ever wrote review pp give use read review year that good film dark grim disturb exactli origin film joke doubt win multipl scar favor go see,Positive
Review 80,"They say it's all in the writing. And this is a great example of that. Good acting and production values cannot save a script steeped in tiresome stereotypes and a failure to delve into a character's identity. We meet the Joker when already imbalanced and his so-called descent into madness is really a couple weeks away; far from a descent, it's a stroll. This is not a character study, despite claims to the contrary. It's a showcase of a good actor overly contorting his body and laughing manically as a mistaken expression of madness. Where is the past? Where are the influences? Where are the conflicts? What are the seminal moments that create the spiral? Perhaps if he had really had that relationship, and had it gone sour, it would justify a descent. Instead, it's a fait accompli. This is lazy writing, focused more on fancy long shots of Joaquin Phoenix dancing crazily than producing something of value to the franchise.",say write great exampl good act product valu can not save script step tiresom stereotyp failur delv charact ident meet joke alreadi balanc call descent mad realli coupl week away far descent stroll charact studi despit claim contrari showcas good actor overlay contort bodi laugh magic mistaken express mad past influenc conflict semin moment creat spiral perhap realli relationship gone sour would justifi descent instead fait accompli lazi write focus fanci long shot joaquin phoenix danc crazi produc someth valu franchis,Negative
Review 81,"Joaquin Phoenix just playing Joaquin Phoenix. Boring, Twisted, Sick piece of crap. A one and done movie.",joaquin phoenix play joaquin phoenix bore twist sick piec cap one done movi,Negative
Review 82,"Story was just really unconvincing. Nobody really cares that much about some random dude who is as ineloquent and uninspired as the joker is. The hype portraying the movie as painful and cruel is just cringe. To see this rated better than ""One flew over cuckoos nest"" that shows way better cruelty saddens me.",stori realli convinc nobodi realli care much random due eloqu inspir joke hope portray movi pain cruel cring see rate better one flew cuckoo nest show way better cruelti sadden,Negative
Review 83,"The performance of Joaquin is excellent but the story simply don't have anything to do with the Joker, it's more about a mentaly ill man struggling with his chaotic enviroment until it's overwhelmed and snaps. I would be a much better film if the title was ""Arthur"" or ""The Clown"" but the fact that it's forced to be related to the batman universe it's why i feld it didn't work.",perform joaquin excel stori simpli dont anyth joke mental ill man struggl chronic environ overwhelm snap would much better film titl arthur clown fact forc relat batman univers felt didn work,Negative
Review 84,"Joaquin Phoenix is good. The directing is pretty good. The writing is absolutely awful. This movie is trying so hard to be relevant and to have a 'message' that it just throws a jumbled mess of quasi-commentary at you hoping something will stick. It is completely unclear what exactly writer/director Todd Phillips is actually trying to say, if anything. Is Joker a hero of the resistance or is he an incel? Does he go crazy because he's mentally ill or because people are mean to him? Both rich people and poor people are horrible to Joker so what exactly is the class commentary? It's also confusing how Robert De Niro when this movie is clearly ripping off Taxi Driver in many ways, also with a little Mr. Robot thrown in. There's also a subplot with a neighbor that is so incredibly stupid and pointless, which actually has no bearing on the story whatsoever. The movie is also just listless and boring throughout much of it. A movie can be slow-paced without it being boring if interesting things are happening that are driving the plot towards it's conclusion. The only thing driving the story in this movie is knowing that he's going to become joker at some points, not anything that actually happens in the movie. The movie also spends like 5 minutes making fun of a little person for no clear reason. Also for people saying that this movie does a good job saying why you should be nicer to people especially if they're lonely or have mental health issues: firstly you shouldn't need a movie like this to be nice to people, secondly you can make a movie like that where the lonely/mentally ill person doesn't become a murderer since mentally ill people are more likely to be victims than perpetrators of crime, and thirdly if you want a movie showing why you need to empathize with criminals why not movies about all the people of color who have been victims of mass incarceration and were locked up on nonviolent charges instead of a movie about a white male becoming a mass murderer. This movie is terrible.",joaquin phoenix good direct pretti good write absolut aw movi tri hard relev messag throw tumbl mess quasicommentari hope someth stick complet unclear exactli writerdirector told phillip actual tri say anyth joke hero resist icel go crazi he mental ill peopl mean rich peopl poor peopl horribl joke exactli class commentari also confus robert de no movi clearli lip taxi driver mani way also littl mr root thrown there also subplot neighbor incred stupid painless actual bear stori whatsoev movi also listless bore throughout much movi slowpac without bore interest thing happen drive plot toward conclus thing drive stori movi know he go becom joke point anyth actual happen movi movi also spend like 5 minut make fun littl person clear reason also peopl say movi good job say nicer peopl especi there lone mental health issu firstli shouldn need movi like nice peopl secondli make movi like lonelyment ill person doesn becom murder sinc mental ill peopl like victim perpetr crime thirdli want movi show need sympath crimin move peopl color victim mass incarcer lock nonviol charg instead movi white male becom mass murder movi terribl,Negative
Review 85,Best acting and story. This is an Oscar winning movie,best act stori oscar win movi,Positive
Review 86,"This film tries desperately to devillify the most stylish and charismatic villain in the DC universe and excruciatingly transform him into a poster child for mental illness in the most tedious manner possible.. This version of the Joker lacks any semblance of style, luster, flair, or charisma, leaving me to wonder why anyone would bother investing the time and money required to create this turkey, much less watch it.

They've murdered the Joker for the sake of some social commentary and PC promotion. I don't deny that mental illness is a real issue or that attention should be brought to it, but folks watch movies about supervillians to see super-villainy, not a 2 hour public service announcement. I hung in there as long as I could hoping for this movie to redeem itself, but about 3 quarters of the way through I could take no more of watching it spin it's wheels.

If you are a fan of the Jack Nicholson or Heath Ledger versions of the Joker then you will likely find this film as painful to watch as I did.",film tri desper devillifi stylish charismat villain do univers excruci transform poster child mental ill tediou manner possibl version joke lack semblanc style luster flair charisma leav wonder anyon would bother invest time money requir creat turkey much le watch they murder joke sake social commentari pp promot dont deni mental ill real issu attent brought folk watch move supervillian see supervillaini 2 hour public servic announc hung long could hope movi redeem 3 quarter way could take watch spin wheel fan jack nicholson heath ledger version joke like find film pain watch,Negative
Review 87,"Somehow the darkest and most serious movies get the highest ratings. People say that this movie is so thrilling and that Joaquin Phoenix deserves an Oscar but at the end of the day, it wasn't entertainment. There were so many evil moments and dark scenes but what's so good about that?

This movie was almost like instructions on how to be a psycho. They flipped the usual idea and boundaries of good and evil for the audience to feel sorry for the bad guy. People seem to think this is a good thing. It's bad!

The point of a movie is to entertain audiences and this movie just made me feel depressed and miserable. I'll have to watch a movie where the hero is clear and the villain is clear so I can actually be entertained. The fundemental and successful formula for a film.",somehow dark seriou move get highest rate peopl say movi thrill joaquin phoenix deserv oscar end day want entertain mani evil moment dark scene what good movi almost like instruct psychic slip usual idea boundari good evil audienc feel sorri bad guy peopl seem think good thing bad point movi entertain audienc movi made feel depress miser ill watch movi hero clear villain clear actual entertain fundament success formula film,Positive
Review 88,"""Joker"" is nor a ""masterpiece"" nor is it ""flawless"" as this board boasts. It's mirely a decent origin, albeit heavy-handed as sin, with choppy flow, poor directing decisions at moments, and part brilliant part wildly overacting on Phoenix's part. The heavy handed nature of mental illness is not written well... It highlghts many different illnesses with none of which feeling whole or handled with much, if any, sense of understanding. Sprinkle in are a few light-hearted moments to remind you that ""hey, he's still funny at times""... But with the strained mental illness angle it's difficult to laugh at these moments without a bit on introspection of what it is and who it is you're laughing at. The real ""danger"" this movie poses is that it's another Hollywood blunder with mental health and its handling... Which does way more harm than good.

There is no great existential pandering, ss some are saying... ""it's deep"", ""my feels"", ""It's not a superhero movie it's a character study"", regardless of what anyone wants to categorize it as.. I'll consider it a generous 3.",joke masterpiec lawless board boat mere decent origin albeit heavyhand sin happi flow poor direct decis moment part brilliant part wildli oper phoenix part heavi hand natur mental ill written well highlight mani differ ill none feel whole handl much sen understand sprinkl lightheart moment remind hey he still funni time strain mental ill angl difficult laugh moment without bit introspect your laugh real danger movi pose anoth hollywood blunder mental health handl way harm good great existenti wander is say deep feel superhero movi charact studi regardless anyon want categori ill consid gener 3,Negative
Review 89,"The reality, far from fiction!! That what's made the movie,,, the oscar winner actor made a new joker rivalry with heath ledger joker, better joker in some people opinion.. piece of art",realiti far fiction what made movi oscar winner actor made new joke rivalri heath ledger joke better joke peopl opinion piec art,Negative
