Doc_Id,Review,Cleaned Data,Sentimental Analysis
Review 24,"I was so hyped up to see this movie, loved the trailer, only movie I have wanted to watch in the cinema for a very long time.

I watched it and was bored. the aesthetics were amazing, music was good, story and execution was meh. the performance of the joker was a good performance but people raving about this are driving me mad. either you have not seen many movies or I have seen too many.

this movie was bang average and was actually boring. I was actually thinking about leaving half way through as I was bored out of my mind.

I do not regret watching it but it is being so overhyped that I am so confused right now. I think it had a good premise but could have been so much more, so much more.

Signs of a great movie is the repeat viewing of it or it moving you, joker did not move me whatsoever and I would not watch it again.

I thought maybe people are getting paid to write good review but have actually met people who think it is the best movie ever.... OMGGG

This movie is bang average and way overhyped.

phoenix performance is good but as the story and execution is so bad, I feel he never even touched the higher spectrum of performance he could have with the character.

I have experienced and seen worse in my life, if this made you feel, you are (i hate this word but have to use it) a snowflake. Please get off social media and live life.

there is a real world out there.",hope see movi love trailer movi want watch cinema long time watch bore aesthet amaz music good stori execut me perform joke good perform peopl rave drive mad either seen mani move seen mani movi bang averag actual bore actual think leav half way bore mind regret watch overhyp confus right think good premis could much much sign great movi repeat view move joke move whatsoev would watch thought mayb peopl get paid write good review actual met peopl think best movi ever ogg movi bang averag way overhyp phoenix perform good stori execut bad feel never even touch higher spectrum perform could charact experienc seen wors life made feel hate word use snowflak plea get social medium live life real world,Negative
Review 25,"BREAKING NEWS: Killer clowns are back! But this time they're not pranksters mimicking Pennywise to scare the sh*t out of people for viral memes; they're ""incels"" threatening to gun down everyone who chooses to take their date to this dour, depressing, demented movie.

If this Joker were the one featured in Nolan's marvelously entertaining Dark Knight, I doubt any of your skinny lonely drugged-up psychos would be rushing to hail this guy as his hero and inspiration.

Ledger's Joker is brilliant, manipulaitve, and consumed with an infectious, and sometimes charming, confidence. Phoenix's Joker is dumb, depressing, and insecure. Ledger makes things happen. Things happen to Phoenix. The Joker controls events in Dark Knight. Events spiral out of control in Joker.

There is no fun in this movie, no great action set pieces, no hint of hope or optimism. It's a two hour slog of watching a miserable man drive himself insane until he starts murdering people. Then seemingly everyone goes insane because ""they've had enough!""

Change the name of this movie to Arthur, eliminate the very few references to the Batman universe, and I doubt you'd think this was an origin story to the Joker we all know and love. Maybe this Joker is the closest to what the Joker would resemble in the real world...which is perhaps why this movie is so awful. Who wants that movie?

There are plenty of good character-driven films of mentally disturbed individuals who spiral out of control. There are plenty of good dark gritty super hero movies. This is neither of them.",break news killer clown back time there prankster mimick pennywis scare she peopl vital mete there inch threaten gun everyon choos take date your depress demand movi joke one featur plan marvel entertain dark knight doubt skinni lone druggedup psychic would rush hail guy hero inspir ledger joke brilliant manipul consum infecti sometim charm confid phoenix joke dumb depress insecur ledger make thing happen thing happen phoenix joke control event dark knight event spiral control joke fun movi great action set piec hint hope optim two hour slow watch miser man drive insan start murder peopl seemingli everyon goe insan they enough chang name movi arthur elimin refer batman univers doubt you think origin stori joke know love mayb joke closest joke would resembl real worldwhich perhap movi aw want movi plenti good characterdriven film mental disturb individu spiral control plenti good dark gritti super hero move neither,Negative
Review 26,"The perfect portrait of a decline to insanity"" & Joaquin Phoenix portrays this flawlessly in a performance of a lifetime. Choreographed impeccably by Todd Phillips & is nothing short of breathtaking. The cinematography & backdrop ideology of such an original film for such a complex character is only complimented by the superb soundtrack & acting. A hauntingly beautiful film & A Definate 10/10. Edit: Bring on part 2 plssssss!. We all want it!.",perfect portrait declin insan joaquin phoenix portray fearlessli perform lifetim choreograph impecc told phillip noth short breathtak cinematographi backdrop ideolog origin film complex charact compliment superb soundtrack act hauntingli beauti film definit 1010 edit bring part 2 plssssss want,Positive
Review 27,"Phoenix convinces me that he has always meant to be the joker. The movie went beyond my expectations, so many emotions went through me these couple hours. I think because its rated R, Phoenix was able to unlock jokers full psychotic potential as the character he is meant to be. This was an AMAZING story, and it calls for more. And I mean a build up, a second movie, maybe one with batman? My hopes are too high at this point, but nevertheless, brilliant goddamn movie and THE BEST joker ever played hands down.",phoenix convinc alway meant joke movi went beyond expect mani emot went coupl hour think rate r phoenix abl clock joke full psychic potenti charact meant amaz stori call mean build second movi mayb one batman hope high point nevertheless brilliant goddamn movi best joke ever play hand,Positive
Review 28,"The pool does not need the money. They need the dignity and respect, coz that is what it takes to be a human. If you don't have that, money will only be a reminder of them being a ""good boy"". Like some politicians, they feel so frustrated when people from the lower class does not accept their funding champions. In this movie, through joker's life, I begin to get it.",pool need money need digniti respect co take human dont money remind good boy like politician feel frustrat peopl lower class accept fund champion movi joke life begin get,Neutral
Review 29,"10/10 Amazing story, Brilliant taking, magnificent cinematography. Someone had to step out of the safe game played by Superhero movies and Joker movie does just that (also The Boys). Movie is gritty, real, insanely dark and sometime quite disturbing to people who don't want accept what's shown in the movie is a terrible reality we face everyday if refused a proper care. Normally people start to compare the movie with one of the greatest like The Dark Knight and in acting wise to that of Heath ledger's Potrayal of joker. I wouldn't say this movie is better that that or otherwise , but it will stand tall amongst the greatest like The Godfather, Taxi Driver, Citizen Kane, The Dark Knight. Coming to the inevitable comparison of who's the better Joker? Heath or Joaquin. The answer is Both did a phenomenal job and the Joker character itself is fortunate to have being played by two greatest actors. Definitely a top contender for Oscars. I personally think it would take away 1.Best Actor 2.Cinematography 3.Original score and if Once Upon a time in Hollywood loses in Make-up and hairstyling category it would definitely be to The Joker.",1010 amaz stori brilliant take magnific cinematographi someon step safe game play superhero move joke movi also boy movi gritti real insan dark sometim quit disturb peopl dont want accept what shown movi terribl realiti face everyday refus proper care normal peopl start compar movi one greatest like dark knight act wise heath ledger betray joke wouldn say movi better otherwis stand tall amongst greatest like godfath taxi driver citizen lane dark knight come inevit comparison who better joke heath joaquin answer phenomenon job joke charact fortun play two greatest actor definit top contend scar person think would take away best actor 2cinematographi origin score upon time hollywood lose make hairstyl categori would definit joke,Neutral
Review 30,"I thought this movie was complete and utter garbage. I don't understand why people liked this movie so much. The character doesn't even stay true to the comics and the director flat out said it didn't, and then they made it seem like it was part of Gothams fall and he was just a little boy that had a laughing problem... Hated it",thought movi complet utter garag dont understand peopl like movi much charact doesn even stay true comic director flat said didn made seem like part gotham fall littl boy laugh problem hate,Negative
Review 31,"I was expecting a masterpiece and oscar worthy film from all the hype. I actually didn't enjoy watching this movie. there was no message, it was slow and the joker turned out just to be the son of a schizophrenic and went crazy over a slight amount of bullying. I don't see how anyone could relate to this character and the laughing is lame acting way overdone. I'm just stunned that this has a 9/10 rating right now, how the hell?",expect masterpiec oscar worthi film hope actual didn enjoy watch movi messag slow joke turn son schizophren went crazi slight amount build dont see anyon could relat charact laugh lame act way everyon in stun 910 rate right hell,Negative
Review 32,"Joaquin' portrayal of a sociopathic, mentally unstable man's transformation to the iconic Joker was non other than a grippingly accurate, realistic and touching rendition. A dark and disturbing character piece led by an Oscar worthy performance by Joaquin Phoenix. You really do feel bad for this guy, which makes it all the more heartbreaking when he inevitably becomes the clown prince of crime we all know and love, although we've never seen him like this. We see him suffer throughout the movie to the point we're almost rooting for himk to become a mass murdering psyco clown, because that at least will make feel better; then it happens and we just wish this could have all just been avoided, because es so messed up. We feel for him and care about him. By the time he's the joker, we wish we could've helped him. There's a lot of great nods to the greater Batman universe, yet the movie is a self contained character piece. That can only be the mark of a great movie. All the acting is great, the plot (while similar to Taxi Driver) is brilliant and the quality of the movie shows you don't need CGI super powers to be a great villain in a Superhero movie. Is a joke not everyone gets. This movie is ""the rise of the Joker!"" 10/10",joaquin portray sociopath mental unstabl man transform iron joke non grip accur realist touch condit dark disturb charact piec led oscar worthi perform joaquin phoenix realli feel bad guy make heartbreak inevit becom clown princ crime know love although were never seen like see suffer throughout movi point almost foot him becom mass murder psyco clown least make feel better happen wish could avoid e miss feel care time he joke wish could help there lot great nod greater batman univers yet movi self contain charact piec mark great movi act great plot similar taxi driver brilliant qualiti movi show dont need chi super power great villain superhero movi joke everyon get movi rise joke 1010,Positive
Review 33,One of the best movies in these few years and 100% Oscar worthy Joaquin Phoenix delivers one of the best performances I've ever scene,one best move year 100 oscar worthi joaquin phoenix deliv one best perform give ever scene,Positive
Review 34,"Seriously, unbelievable. Dare I say better than Heath Ledger? If Joaquin Phoenix doesn't win the Oscar for best actor and 'Joker' doesn't win at the VERY least, best screenplay, it will be one of the biggest Oscar snubs of our time",serious unbeliev dare say better heath ledger joaquin phoenix doesn win oscar best actor joke doesn win least best screenplay one biggest oscar snub time,Positive
Review 35,"This movie answers this question...what will the Joker be if he was a real life character ? A great deep and moving story, a life journey of a man who's suffering from some psychological issues and how neglect, bullying and rudeness by other human being can push a man to complete madness.

Although it's not accurate to any comic book adaptation or any TV series or movie before it, yet it's a fresh and unique take on the character of the clown prince of crime from a realistic approach and I believe with Joaquin Phoenix amazing performance as the Joker in which he managed to bring a real life look-alike early version of the Joker which although is not comic book accurate but I feel it's a very decent foundation for Joker 2 which should be more true to heart of the original version of our lovable villain.

The movie is over all a great piece of filmmaking in all of its aspects. From the plot which was very interesting, believable and many can relate to it, through the acting which was impressively splendid to the directing which was outstanding. My main take on the movie is the lack of any positive lead character, I know we live in a tough world which full of negativity but there are some positive examples here and there and to shed some light on one or two characters in this movie would've been a nice positive thought.

The Joker movie can be misunderstood by many thinking it'll inspire crime and violence but I believe on the contrary that many who go through hard life will feel sympathy for the Joker character, others will even relate to his misery and may justify his actions. I believe the movie is meant to be a wake up call for many! A lot of people daily suffer from bullying, racism, hate crimes or neglect and sometimes they go through worse, we should take a deeper look at our actions and know that - aside from money and authority - we are all equally humans, we should treat one another the same way we expect to be treated.",movi answer questionwhat joke real life charact great deep move stori life journey man who suffer psycholog issu neglect build rude human push man complet mad although accur comic book adapt to seri movi yet fresh uniqu take charact clown princ crime realist approach believ joaquin phoenix amaz perform joke manag bring real life lookalik earli version joke although comic book accur feel decent foundat joke 2 true heart origin version movabl villain movi great piec filmmak aspect plot interest believ mani relat act impress splendid direct outstand main take movi lack posit lead charact know live tough world full nativ posit exampl shed light one two charact movi would nice posit thought joke movi misunderstood mani think till inspir crime violenc believ contrari mani go hard life feel sympathi joke charact other even relat miseri may justifi action believ movi meant wake call mani lot peopl daili suffer build racism hate crime neglect sometim go wors take deeper look action know asid money author equal human treat one anoth way expect treat,Neutral
Review 36,"While the trailers for this movie have may seemed like there was potential for an action packed movie, this movie, clearly before it came to theaters was intended to be a progressive character study. You shouldn't go into this movie expecting intense action or the joker we know of the past. This is a movie about how Arthur Fleck becomes the Joker.

I have seen so many bad reviews about how boring or slow the movie is, but I believe it was utter perfection. The first part of the movie we begin to understand Arthur as a person. All of his interactions with everyone in his life, be it good or bad. The whole point of a character study is evolution. And this is far and away one of the greatest evolutions of a character I have ever seen in a movie.

Joaquin Phoenix's performance is by far the best acting I have seen in a movie possibly in the last few decades. We see a challenged person be challenged by society and it completely breaks him down over time. And Joaquin isn't acting, he is evolving all throughout the movie. If anyone thinks he doesn't put on an Oscar winning performance, they're out of their effing mind. Yes, the movie is slow to start, but it has to be. We couldn't just jump into the joker and all the chaos. We need to know where it came from to begin with.

The whole compilation of the movie is amazing. The complete Oscar deserving performance of Joaquin, the choreography, the cinematography, the score. Everything is in perfect harmony. While there may have been a lot of controversy surrounding this movie, the team put together a perfect movie and I pity those who can't appreciate the tears and sweat and emotion that went into making this movie.

I have always been so one sided in my movie preferences between Marvel and DC. I feel like Marvel is sooo much better overall and most movies DC puts out are trash. But Joker is far and away my favorite comic movie. Even though it takes a completely different spin on comic movies. You have to appreciate the evolution to appreciate this movie. It's not an action movie, but it's really rips and tears at all the emotions in one movie while adding a wild suspenseful kick. No other comic book movie has done that before.",trailer movi may seem like potenti action pack movi movi clearli came theater intend progress charact studi shouldn go movi expect intens action joke know past movi arthur fleck becom joke seen mani bad review bore slow movi believ utter perfect first part movi begin understand arthur person interact everyon life good bad whole point charact studi evolut far away one greatest evolut charact ever seen movi joaquin phoenix perform far best act seen movi possibl last decad see challeng person challeng societi complet break time joaquin isn act revolv throughout movi anyon think doesn put oscar win perform there eat mind ye movi slow start couldn jump joke chao need know came begin whole compil movi amaz complet oscar deserv perform joaquin choreographi cinematographi score everyth perfect harmoni may lot controversi surround movi team put togeth perfect movi piti can appreci tear sweat emot went make movi alway one side movi refer marvel do feel like marvel soon much better overal move do put trash joke far away favorit comic movi even though take complet differ spin comic move appreci evolut appreci movi action movi realli lip tear emot one movi ad wild suspens kick comic book movi done,Neutral
Review 37,Don't waste 2 hours of your life this movie is the baddest i've seen in a long time. Crappy writing and no good storyline...it was boring. I went to the pay counter to ask my money back for the 2 hours of torture...they can't do people like this. And for all the people with 10/10(the reason why i went) you're a joke.,dont wast 2 hour life movi saddest give seen long time happi write good storylineit bore went pay counter ask money back 2 hour torturethey can peopl like peopl 1010the reason went your joke,Negative
Review 38,"What an incredible ride this was. I was almost motionless throughout, watching in awe the performance of a lifetime - the transition from troubled man to monster, the hounding score which directly drove the goosebumps, the cinematography which made you feel like you were flying through Gotham looking for Arthur yourself and the masterful De Niro who gave his nod to Jerry Lewis. Ignore DC. Ignore Batman. This is a work of art in its own right.",incred ride almost motionless throughout watch awe perform lifetim transit troubl man monster found score directli drove goosebump cinematographi made feel like fli gothic look arthur wast de no gave nod merri lewi ignor do ignor batman work art right,Positive
Review 39,"I don't understand the high ratings. I went to the cinema with high expectations, only to discover that the movie was slow as anything and was almost finished before the first killing happened. It was a dreadful time having to wait for something to happen. But yes, once the movie was finished and I finally walked out, I got the cosmic joke; I was the joker, trusting the reviews and leaving disappointed in disbelief I actually paid for watching it.",dont understand high rate went cinema high expect discov movi slow anyth almost finish first kill happen dread time wait someth happen ye movi finish final walk got comic joke joke trust review leav disappoint disbeliev actual paid watch,Positive
Review 40,"Joaquín Phoenix's unconvincing laughing, and looking like a beaten dog had brutaly ennoyed me after 5 minutes. The world is mean and bad, and you can only be bad and hit back. Chaos, anarchy, whatever .. inspires bye a clown who killed 3 bullies. More of this stupid excess of brutality in the name of... what? Yes. It is the same director as in the hangover 3. I don't want to be a partir of this. Brutal and boring.",joaquín phoenix convinc laugh look like beaten dog brutal enjoy 5 minut world mean bad bad hit back chao anarchi whatev inspir bye clown kill 3 gulli stupid excess brutal name ye director hanov 3 dont want parti brutal bore,Negative
Review 41,"Masterpiece, one of the best films of the decade, it has it all, acting, directing, setting, photography, soundtrack, in a few years this film will be a cult one.",masterpiec one best film decad act direct set photographi soundtrack year film cult one,Positive
